title,image,score,studio,genre,created_at
Inu x Boku SS,https://m.media-amazon.com/images/M/MV5BODk1NDQ3NzI2NV5BMl5BanBnXkFtZTgwNjkxMTY4NjE@._V1_FMjpg_UX1000_.jpg,7.63,David Production,"Comedy, Supernatural, Romance, Shounen",2022-12-01
Ouran Koukou Host Club,https://cdn.myanimelist.net/images/about_me/ranking_items/10768655-dec643c6-060f-4382-907b-f09576cbe3bf.jpg?t=1660102374,8.34,Bones,"Comedy, Harem, Romance, School, Shoujo",2022-12-01
Bleach,https://upload.wikimedia.org/wikipedia/en/7/72/Bleachanime.png,7.9,Studio Pierrot,"Action, Adventure, Comedy, Super Power, Supernatural, Shounen",2022-12-01
Kimi ni Todoke,https://m.media-amazon.com/images/M/MV5BZDdhNjRhN2ItZjQzNy00NzdlLTllYzEtYjI5NzYwMjY0ZjZjXkEyXkFqcGdeQXVyNjc3MjQzNTI@._V1_.jpg,8.13,Production I.G,"Slice of Life, Drama, Romance, School, Shoujo",2022-12-01
Naruto: Shippuuden,https://m.media-amazon.com/images/M/MV5BZGFiMWFhNDAtMzUyZS00NmQ2LTljNDYtMmZjNTc5MDUxMzViXkEyXkFqcGdeQXVyNjAwNDUxODI@._V1_.jpg,8.18,Studio Pierrot,"Action, Adventure, Comedy, Super Power, Martial Arts, Shounen",2022-12-01
Ranma ½,https://m.media-amazon.com/images/M/MV5BMDQ0OGEwNDItNzVmZi00NGI0LTk3YWUtNmQzN2Y1YzYwY2NmXkEyXkFqcGdeQXVyNzA5NjUyNjM@._V1_FMjpg_UX1000_.jpg,7.85,Studio Deen,"Slice of Life, Comedy, Martial Arts, Fantasy",2022-12-01
Toradora!,https://m.media-amazon.com/images/M/MV5BNWEwMjE2MjQtZTQ3NC00OTUxLWEwMWUtMThjZjg4Zjc5ZDYwXkEyXkFqcGdeQXVyMzgxODM4NjM@._V1_.jpg,8.39,J.C.Staff,"Slice of Life, Comedy, Romance, School",2022-12-01
Bakuman. 2nd Season,https://m.media-amazon.com/images/M/MV5BZDVjZGZlOTAtYjgwYS00NDU0LWJiODEtNmI5Y2YyNWRlN2Q0XkEyXkFqcGdeQXVyNTAyODkwOQ@@._V1_.jpg,8.49,J.C.Staff,"Comedy, Drama, Romance, Shounen",2022-12-01
Skip Beat!,https://www.crunchyroll.com/imgsrv/display/thumbnail/480x720/catalog/crunchyroll/e00518316caccd8f76313c69b5a3c4a8.jpeg,8.24,Hal Film Maker,"Comedy, Drama, Romance, Shoujo",2022-12-01